query,tweet
MBG,"Hidup jangan menghujat

Ide kreatif, berinisiatif buka lapak makanan dg nama MBG (Mantap Banget Gila) ala tebet

Begitu buka mengundang pemasaran yg lewat, laris makin laris

Banyak umkm titip jualan

Di sosmed diingatkan, hati2  didatangi aparat

Ternyata benar tapi beli"
MBG,"Tenaga Terkuras Guru pun Difitnah, Blak-blakan SMAN 1 Ciemas Tak Mau Lagi Urus MBG"
MBG,"Udah sempat ada yang ngitung kalo gak salah 1,4 Triliun rupiah perbulan dibuang dari Proyek MBG cuma dari food waste aja."
MBG,MBG lebih sexy daripada kesejahteraan Guru...
MBG,"MBG bukan soal bagi-bagi makan. Program MBG diuji lewat riset sebelum diperluas. Gizi anak dijaga, ekonomi masyarakat ikut bergerak.
Hasil riset MBG"
MBG,Puluhan Siswa di wilayah Duren Sawit mengalami keracunan diduga karena MBG.
MBG,"Lihatlah!

Bangunan SD penerima manfaat MBG dengan Bangunan SPPG nya.

© Ari Pizzahitsmajalengka on FB"
MBG,"Temuan mengejutkan terjadi dalam program Makan Bergizi Gratis (MBG) di SDN Cisarandi 1, Cianjur, pada Selasa, 7 April 2026. Sejumlah siswa dilaporkan enggan makan setelah ditemukan belatung dalam menu makanan yang dibagikan di sekolah.

Menurut guru SDN Cisarandi 1, Didan,"
MBG,Komposisi susu import buat menu mbg di cianjur nih guys wkwwkwk
MBG,superindo harusnya buka mbg ga sih? sgini 14.900 mana enak bgt
makan bergizi gratis,"Makan bergizi gratis? Wah, mantap banget! Yuk, manfaatin program dari pemerintah ini. Jadi sehat, jadi semangat!"
makan bergizi gratis,"Anak senang, ekonomi riang! Hasil riset MBG menunjukkan dampak nyata dari Program Makan Bergizi Gratis.  #IndonesiaMaju #MBG"
makan bergizi gratis,"Makan bergizi gratis, bro!  Dukungan pemerintah buat kesehatan kita semua! Yuk, manfaatin kesempatan ini dan jaga kesehatan bareng!"
makan bergizi gratis,"Ayo dukung MBG 
#DariMBGUntukIndonesiaHebat"
makan bergizi gratis,Yeuu itu mah bukan makan bergizi GRATIS dong namanya
makan bergizi gratis,"Dimana otaknya?
Gue yang tiap hari makan ga ada ahli gizi nya aja aman² aja, ga pernah keracunan makanan. Padahal makanya lenga jlantah"
makan bergizi gratis,"Judul programnya makan bergizi gratis, anggaran buat beli motor 42 juta sebanyak 31.000!!! Giliran buat anggaran makanan anak2nya malah cuman 10.000 / anak. Dimana logikanya?"
makan bergizi gratis,61 Juta Anak Sudah Merasakan Program Makan Bergizi Gratis
makan bergizi gratis,Makan bergizi gratis? Keren banget! Ini langkah nyata pemerintah untuk jaga kesehatan kita semua. Ayo dukung program ini!
makan bergizi gratis,"Zulkifli Hasan menekankan pentingnya sinergi dalam program makan bergizi gratis
suaraindonesia.co.id/news/news/69d7
…

#MenkoPangan
#PartaiAmanatNasional
#ZulkifliHasan
#Zulhas
#GD_Zulhas"
makan bergizi gratis,yeuh ini aja hak seluruh rakyat indonesia tapi gak semua dapet
makan bergizi gratis,"Ngejarah duit rakyat mulu yaaaa anj ini orang orang,MBG minta patungan kwwkwk"
program makan gratis,"Kalo otaknya ga berguna jd dpr, sumbangin jadi menu mbg aja sama2 ga bergizi"
program makan gratis,Kualitas SDM Indonesia di tahun 2045 ditentukan oleh apa yang dikonsumsi siswa di sekolah hari ini. Program makanan bergizi gratis adalah investasi nyata untuk memastikan generasi mendatang memiliki ketahanan fisik yang mumpuni.
program makan gratis,"Program Makan Bergizi Gratis atau MBG diluncurkan 6 Januari 2025 dengan 190 dapur SPPG di 26 provinsi melayani sekitar 570.000 penerima. 
Setahun kemudian sudah ada 19.000 lebih SPPG di 38 provinsi, menjangkau 56 juta orang, mempekerjakan hampir 790.000 pekerja, dan memproduksi"
program makan gratis,Program Makan Bergizi Gratis dapat membantu meningkatkan gigi anak-anak Indonesia sehingga anak-anak Indonesia dapat belajar dengan fokus dan semangat sehingga bisa mewujudkan generasi emas Indonesia. Kawal bersama MBG untuk Indonesia yang lebih baik.
program makan gratis,Badan Gizi Nasional (BGN) kembali menghentikan sementara operasional (suspend) ratusan Satuan Pelayanan Pemenuhan Gizi (SPPG) di sejumlah wilayah. Langkah ini diambil untuk memastikan pelaksanaan Program Makan Bergizi Gratis (MBG) tetap berjalan sesuai standar kualitas dan
program makan gratis,"Program Makan Bergizi Gratis (MBG) bukan sekadar pemenuhan nutrisi, tapi juga penggerak ekonomi riil. 

#MakanBergiziGratis #EkonomiKerakyatan #IndonesiaSehat #KetahananPangan #PemerataanGizi"
program makan gratis,Program Makan Bergizi Gratis Pemerintah Prabowo-Gibran diyakini sebagai langkah progresif dalam mengatasi malnutrisi nasional #MBG #MakanBergiziGratis
MBG Indonesia,"Distribusi Makan Bergizi Gratis lebih dari sekadar dapur. Dari SPPG ke sekolah, setiap anak berhak mendapat gizi terbaik. Satu tujuan: masa depan lebih kuat. Program nasional ini membawa dampak langsung bagi generasi bangsa. 
MBG satu tujuan
Pemenuhan Gizi Anak Indonesia"
MBG Indonesia,"Indonesia cemas, rakyat siap siap ke psikolog buat konseling stres hidup di negeri ini. MBG lanjut terus sampe terompet sangkakala ditiup. Kalo disetop aja itu program bisa hemat banyak tapi ah sudahlah .."
MBG Indonesia,"Aset Hutan Dikonversi Jadi Uang Seolah-olah Bisa Digunakan Untuk Perbaiki dan Modernisasi Sekolah Indonesia, 335 T Anggaran MBG Aja Loe Pakai Ga Usah Banyak Omon-Omon!!!"
MBG Indonesia,"Bos BGN Buka Suara soal Viral Motor Listrik untuk MBG

Tonton selengkapnya di  atau download app CNBC Indonesia di AppStore dan PlayStore!"
MBG Indonesia,"Presiden RI Prabowo Subianto optimis ekonomi Indonesia terus tumbuh dengan menjaga stabilitas.
Program MBG menjangkau 60,2 juta penerima dan membuka lebih dari 1 juta lapangan kerja, ditopang Koperasi Desa Merah Putih hingga 30.000 unit
Prabowo Jaga Ekonomi Indonesia"
MBG Indonesia,"Saya kira dulu indonesia ini miskin, tapi setelah ada mbg baru saya tau ternyata kaya, 1,2 triliun perhari, 335 triliun pertahun, kemana aja itu duit selama ini.."
MBG Indonesia,Program Makan Bergizi Gratis telah menghadirkan kebahagiaan bagi pelaku UMKM dan masyarakat yang terlibat dalam pelaksanaan Program MBG. Hal ini bagian dari MBG satu tujuan yakni Pemenuhan Gizi Anak Indonesia dan meningkatkan kesejahteraan masyarakat.
MBG Indonesia,"Program MBG terus diperkuat sebagai bagian dari visi Prabowo Subianto menuju Indonesia Emas 2045. Fokus pada pencegahan stunting di 1000 HPK, distribusi yang tepat untuk 3B jadi kunci agar manfaatnya benar-benar dirasakan."
MBG Indonesia,Mbg ini program yang bikin indonesia miskin
MBG Indonesia,See some of u aren’t revolutionary enough for a country so rotten in every life aspect
MBG Indonesia,"Fakta pahit MBG

Suka ga suka, MBG gak akan dihentikan sekalipun 2029 Prabowo diganti.

Ini program populis banget. Menghidupi ribuan orang. Gaakan ada yang berani menghentikan, political costnya kemahalan.

The best case scenario MBG adalah sistemnya diubah..."
MBG Indonesia,"Mom mau tanya, emang mbg di Indonesia, sebermasalah itu ya?"
MBG Indonesia,"MBG ditegaskan sebagai program pelayanan publik, bukan ruang bisnis baru. Fokus utamanya jelas: memastikan anak-anak Indonesia mendapat asupan gizi yang layak dan merata."
MBG Indonesia,selama ada mbg Indonesia ttp aman
kebijakan makan gratis,"Pemerintah dan BGN mengambil kebijakan Program Makan Bergizi Gratis tetap dijalankan pada momen bulan Ramadhan.
Menu MBG keringan menjadi pilihan SPPG untuk diberikan kepada penerima manfaat di seluruh Indonesia.

#LanjutkanMBG

Liga Champions #bbvipal5 
LPDP Meksiko Norwegia"
kebijakan makan gratis,"Even on a free table, eat what you can buy."
kebijakan makan gratis,Pendidikan gratis dibiayai negara ada dalam UUD sdgkan makan gratis utk anak2 itu tugas orangtua nya....
kebijakan makan gratis,"Aneh kalau program makan gizi gratis ditolak. Di pelosok banyak anak yang terbantu banget sama MBG ini. Kesejahteraan guru jalan terus lewat kebijakan lain, tapi gizi anak nggak boleh ditunda. Jangan mau diprovokasi narasi begini. #LanjutkanMBG"
kebijakan makan gratis,"Presiden RI Prabowo Subianto mengungkapkan, lebih dari 1.000 dapur Satuan Pelayanan Pemenuhan Gizi (SPPG) dalam program Makan Bergizi Gratis (MBG) telah diberhentikan sementara atau di-suspend sebagai bagian dari upaya pembenahan kualitas layanan.

Prabowo menegaskan, kebijakan"
kebijakan makan gratis,Yg di up freebies barang ya soalnya yg ngasi makanan udah pada gue cemilin
kebijakan makan gratis,"MBG
Makan Bergizi Gratis 
Motor Berlistrik Gratis"
kebijakan makan gratis,"Nutrisi adalah hak, bukan kemewahan. Melalui kebijakan Makan Bergizi Gratis, pemerintah hadir untuk memastikan setiap anak sekolah memiliki energi yang sama untuk bermimpi dan berkarya. Bersama, kita bangun pondasi bangsa yang lebih kuat dan sehat!  #IndonesiaSehat"
kebijakan makan gratis,"Di kost tuh gue bisa bebas ngapain aja, salah satu nya bebas makan mie kapan pun"
kebijakan makan gratis,"Dari awal juga emg kagak ada, pada gblk bae orang"
kebijakan makan gratis,"Dampak Program Makan Bergizi Gratis: Anak Senang, Orangtua Bisa Hemat Pengeluaran 
pantauriau.com/news/detail/47
…"
kebijakan makan gratis,"nah ini mksdnya.. kenapa mereka sepelit itu ya, coba kalau misal anggaran buat makanan lebih gede Ahli Gizi bikin menu yang berkualitas jg enak gausa ngepatok di harga terus anjr"
kebijakan makan gratis,Bayar aja sendiri ngapain ngasi makan anak orang
kebijakan makan gratis,"Permohonan ini diajukan terkait penyelundupan kebijakan Program Makan Bergizi Gratis (MBG) yang dimasukkan ke dalam komponen anggaran pendidikan & dinilai menggerus pendanaan penyelenggaraan pendidikan nasional, termasuk berdampak pada kesejahteraan guru dan kualitas pendidikan"
kebijakan makan gratis,в бизнес зале часто есть бесплатновая еда
kebijakan makan gratis,"Kepercayaan publik dan pertumbuhan ekonomi riil..
Kepercayaan bukan diberikan, tapi dimenangkan melalui hasil nyata. Angka kepuasan publik 79,9% adalah cermin dari kebijakan yang menyentuh akar rumput.

Program Makan Bergizi Gratis bukan hanya tentang membagikan porsi makanan,"
